{
  "$schema": "https://json-schema.org/draft/2020-12/schema",
  "$id": "wave-plan.schema.json",
  "title": "Wave Plan",
  "description": "Output of the plan-analyzer agent. Defines waves of file-disjoint dev tasks (max 6 per wave).",
  "type": "object",
  "required": ["source_plan", "context7_available", "waves", "uncovered_plan_sections"],
  "properties": {
    "source_plan": {"type": "string", "description": "Path to the input plan.md file"},
    "context7_available": {"type": "boolean"},
    "waves": {
      "type": "array",
      "minItems": 1,
      "items": {
        "type": "object",
        "required": ["wave_id", "rationale", "agents"],
        "properties": {
          "wave_id": {"type": "integer", "minimum": 1},
          "rationale": {"type": "string"},
          "agents": {
            "type": "array",
            "minItems": 1,
            "maxItems": 6,
            "items": {
              "type": "object",
              "required": ["agent_id", "task_title", "task_excerpt", "owned_files", "acceptance_criteria", "recommended_model", "complexity_signals"],
              "properties": {
                "agent_id": {"type": "string", "pattern": "^wave-[0-9]+-agent-[0-9]+$"},
                "task_title": {"type": "string"},
                "task_excerpt": {"type": "string"},
                "owned_files": {"type": "array", "minItems": 1, "items": {"type": "string"}},
                "acceptance_criteria": {"type": "array", "minItems": 1, "items": {"type": "string"}},
                "recommended_model": {"type": "string", "enum": ["haiku", "sonnet", "opus"]},
                "complexity_signals": {"type": "array", "items": {"type": "string"}}
              }
            }
          }
        }
      }
    },
    "uncovered_plan_sections": {"type": "array", "items": {"type": "string"}}
  }
}
